"Artist","Classifications","Color","Franchise","Image","Cost","Inkable","Name","Type","Lore","Rarity","Flavor_Text","Body_Text","Willpower","Strength","prints","Abilities","Card_Variants","Move_Cost"
"Jonas Petrauskas",,"Emerald","Encanto","https://lorcana-api.com/images/vision_slab/vision_slab-large.png",3,true,"Vision Slab","Item",,"Uncommon","""Tio Bruno! What's happening to him? We have to help!""
-Mirabel","Danger Revealed - At the start of your turn, if an opposing character has damage, gain 1 lore.
Trapped! Damage counters can't be removed.",,,"[""URS-100""]",,,
"Jonathan Livslyst",,"Emerald","The Little Mermaid","https://lorcana-api.com/images/ursula's_garden/full_of_the_unfortunate/ursula's_garden-full_of_the_unfortunate-large.png",4,true,"Ursula's Garden - Full of the Unfortunate","Location",1,"Rare",,"Abandon Hope - While you have an exerted character here, opposing characters get -1{l}.",7,,"[""URS-102""]",,,2
"Ian MacDonald","Storyborn, Hero, Prince","Ruby","The Beauty and the Beast","https://lorcana-api.com/images/beast/wounded/beast-wounded-large.png",3,true,"Beast - Wounded","Character",2,"Uncommon","It wasn't the severity of the wounds but the sickly substance that caused such unbearable pain.","That Hurts!: This character enters play with 4 damage.",6,2,"[""URS-103""]",,,
"Eri Welli","Storyborn, Mentor, King","Ruby","Raya and the Last Dragon","https://lorcana-api.com/images/benja/bold_united/benja-bold_united-large.png",4,true,"Benja - Bold United","Character",1,"Common","""We must work together to heal the entangled.""",,3,5,"[""URS-104""]",,,
"Carmine Pucci","Storyborn, Mentor","Ruby","Mulan","https://lorcana-api.com/images/fa_zhou/mulan's_father/fa_zhou-mulan's_father-large.png",2,true,"Fa Zhou - Mulan's Father","Character",1,"Common","""I am ready to serve the Emperor.""","War Injury: This character can't challenge.
Head of The Household: {e} - Ready chosen character named Mulan. She can't quest for the rest of this turn.",4,0,"[""URS-105""]",,,
"Mike Me","Storyborn, Hero, Prince","Ruby","Tangled","https://lorcana-api.com/images/flynn_rider/frenemy/flynn_rider-frenemy-large.png",2,true,"Flynn Rider - Frenemy","Character",1,"Super Rare","""You guys look busy-I'll just keep an eye on this lore for you.""","Narrow Advantage: At the start of your turn, if you have a character in play with more {s} than each opposing character, gain 3 lore.",2,2,"[""URS-106""]",,,
"Justin Runfola","Storyborn, Hero","Ruby","Classic Disney","https://lorcana-api.com/images/goofy/super_goof/goofy-super_goof-large.png",4,true,"Goofy - Super Goof","Character",1,"Rare","Never underestimate the power of a Goof.","Rush (This character can challenge the turn they're played.)
Super Peanut Powers: Whenever this character challenges another character, gain 2 lore.",4,2,"[""URS-107""]","Rush",,
"Antoine Couttolenc","Storyborn, Hero, Prince","Ruby","Hercules","https://lorcana-api.com/images/hercules/clumsy_kid/hercules-clumsy_kid-large.png",3,false,"Hercules - Clumsy Kid","Character",1,"Common","""Nice catch, Jerkules.""
-Village boy","Rush (This character can challenge the turn they're played.)
",3,3,"[""URS-108""]","Rush",,
"Diogo Saito","Dreamborn, Hero, Prince","Ruby","Hercules","https://lorcana-api.com/images/hercules/daring_demigod/hercules-daring_demigod-large.png",5,false,"Hercules - Daring Demigod","Character",0,"Uncommon",,"Rush (This character can challenge the turn they're played.)
Reckless (This character can't quest and must challenge each turn if able.)",3,7,"[""URS-109""]","Rush, Reckless",,
"Nicholas Kole","Storyborn, Ally","Ruby","Mulan","https://lorcana-api.com/images/khan/beloved_steed/khan-beloved_steed-large.png",2,true,"Khan - Beloved Steed","Character",1,"Uncommon","As silent as a shadow and faster than the wind: brave Khan, the mightiest stallion.",,2,3,"[""URS-110""]",,,
"Brian Kesinger","Storyborn, Hero","Ruby","Mulan","https://lorcana-api.com/images/li_shang/general's_son/li_shang-general's_son-large.png",1,true,"Li Shang - General's Son","Character",1,"Common","His training was unsurpassed, but it was his courage that would see him through this fight.",,2,2,"[""URS-111""]",,,
"Nicola Saviori","Floodborn, Hero","Ruby","Mulan","https://lorcana-api.com/images/li_shang/valorous_general/li_shang-valorous_general-large.png",3,true,"Li Shang - Valorous General","Character",1,"Uncommon",,"Shift: Discard a character card (You may discard a character card to play this on top of one of your characters name Li Shang.)
Lead the Charge: Your characters with 4{s} or more get +1{l}.",2,3,"[""URS-112""]","Shift",,
"Jared Mathews","Storyborn, Hero, Princess","Ruby","Mulan","https://lorcana-api.com/images/mulan/enemy_of_entanglement/mulan-enemy_of_entanglement-large.png",2,true,"Mulan - Enemy of Entanglement","Character",1,"Uncommon","Ursula's messengers fled leaving behind tendrils of dark ink.","Time To Shine: Whenever you play an action, this character gets +2{s} this turn.",3,1,"[""URS-115""]",,,
"Kasia Brzezinska","Storyborn, Villain, Princess","Ruby","Raya and the Last Dragon","https://lorcana-api.com/images/namaari/heir_of_fang/namaari-heir_of_fang-large.png",3,false,"Namaari - Heir of Fang","Character",1,"Rare",,"Two-Weapon Fighting: During your turn, whenever this character deals damage to another  character in a challenge, you may deal the same amount of damage to another chosen character.",3,2,"[""URS-117""]",,,
"Justin Runfola","Storyborn, Villain","Ruby","Hercules","https://lorcana-api.com/images/nessus/river_guardian/nessus-river_guardian-large.png",6,true,"Nessus - River guardian","Character",2,"Uncommon","He sent the eels away when they came with the sea witch's offer. He didn't need her help making trouble.",,5,7,"[""URS-118""]",,,
"Denny Minonne","Storyborn, Ally","Ruby","Raya and the Last Dragon","https://lorcana-api.com/images/noi/acrobatic_baby/noi-acrobatic_baby-large.png",4,true,"Noi - Acrobatic Baby","Character",1,"Super Rare","Fortune favors the bold-no matter how small.","Fancy Footwork: Whenever you play an action, this character takes no damage from challenge this turn.",4,4,"[""URS-119""]",,,
"Kenneth Anderson","Storyborn, Ally","Ruby","Hercules","https://lorcana-api.com/images/pegasus/flying_steed/pegasus-flying_steed-large.png",2,true,"Pegasus - Flying Steed","Character",1,"Common","""He zigs, he zags - what else do ya need?""
-Phil","Evasive (Only characters with Evasive can challenge this character.)",1,3,"[""URS-120""]","Evasive",,
"Peter Brockhammer","Storyborn, Hero, Princess","Ruby","Raya and the Last Dragon","https://lorcana-api.com/images/raya/fierce_protector/raya-fierce_protector-large.png",3,true,"Raya - Fierce Protector","Character",1,"Super Rare","""You're gonna fight an entire army?""","Don't Cross Me: Whenever this character challenges another character, gain 1 lore for each other damaged character you have in play.",3,3,"[""URS-121""]",,,
"Brittney Hackett","Storyborn, Hero, Princess","Ruby","Raya and the Last Dragon","https://lorcana-api.com/images/raya/guardian_of_the_dragon_gem/raya-guardian_of_the_dragon_gem-large.png",4,true,"Raya - Guardian of the Dragon Gem","Character",2,"Common","""There are too many of them for me. But no for us.""","We Have Come Together: When you play this character, ready chosen character of yours at a  location. They can't quest for the rest of this turn.",3,3,"[""URS-122""]",,,
"Grace Tran","Floodborn, Hero, Deity, Dragon","Ruby","Raya and the Last Dragon","https://lorcana-api.com/images/sisu/empowered_sibling/sisu-empowered_sibling-large.png",8,false,"Sisu - Empowered Sibling","Character",3,"Legendary",,"Shift 6 (You may pay 6{i} to play this on top of one of your characters named Sisu.)
I Got This!: When you play this character, banish all opposing characters with 2{s} or less.",4,5,"[""URS-125""]","Shift 6",,
"Mike Parker","Storyborn, Ally","Ruby","Raya and the Last Dragon","https://lorcana-api.com/images/tong/survivor/tong-survivor-large.png",4,false,"Tong - Survivor","Character",0,"Common","""I too wish to join the fellowship of Druun butt-kickery.""","Reckless (This character can't quest and must attack each turn if able.)",6,3,"[""URS-126""]","Reckless",,
"R. la Barbera / L. Giammichele",,"Ruby","Tangled","https://lorcana-api.com/images/brawl/brawl-large.png",3,true,"Brawl","Action",,"Common","There are two ways to leave the Snuggly Duckling - the door or the window.","Banish chosen character with 2{s} or less.",,,"[""URS-130""]",,,
"Devin Yang",,"Ruby","Mulan","https://lorcana-api.com/images/imperial_proclamation/imperial_proclamation-large.png",1,true,"Imperial Proclamation","Item",,"Rare","""By order of the Emperor, one man from every family must serve in the Imperial Army.""
- Chi Fu","Call To The Front: Whenever one of your characters challenge another character, you may pay 1{i} less for the next character you play this turn.",,,"[""URS-131""]",,,
"Roberto Gatto",,"Ruby","Peter Pan","https://lorcana-api.com/images/the_plank/the_plank-large.png",3,false,"The Plank","Item",,"Common","It's a once-in-a-lifetime view.","Walk!: 2{i}, Banish this item - Choose one:
• Banish chosen Hero character.
• Ready chosen Villain character. They can't quest for the rest of this turn.",,,"[""URS-133""]",,,
"Sandara Tang",,"Ruby","Lorcana","https://lorcana-api.com/images/vitalisphere/vitalisphere-large.png",1,true,"Vitalisphere","Item",,"Common",,"Extract of Ruby: 1{i}, Banish this item - Chosen character gains Rush and gets +2{s} this turn. (They can challenge the turn they're played.)",,,"[""URS-134""]","Rush",,
"Jeremy Adams",,"Ruby","Tangled","https://lorcana-api.com/images/snuggly_duckling/disreputable_pub/snuggly_duckling-disreputable_pub-large.png",2,true,"Snuggly Duckling - Disreputable Pub","Location",,"Rare",,"Routine Ruckus: Whenever a character with 3{s} or more challenge another character while here, gain 1 lore. If the challenging character has 6{s} or more, gain 3 lore instead.",9,,"[""URS-135""]",,,2
"Matthew Oates",,"Ruby"," Mulan","https://lorcana-api.com/images/training_grounds/impossible_pillar/training_grounds-impossible_pillar-large.png",1,true,"Training Grounds - Impossible Pillar","Location",0,"Common",,"Strength of Mind: 1{i} - Chosen character here gets +1{s} this turn.",5,,"[""URS-136""]",,,1
"Miss Tania Doler","Storyborn, Hero, Princess","Sapphire","The Little Mermaid","https://lorcana-api.com/images/ariel/treasure_collector/ariel-treasure_collector-large.png",6,false,"Ariel - Treasure Collector","Character",3,"Super Rare",,"Ward (Opponents can't choose this character except to challenge.)
The Girl Who Has Everything: While you have more items in play than each opponent, this character gets +2{l}.",4,3,"[""URS-139""]","Ward",,
"Koni","Floodborn, Hero, Princess","Sapphire","Sleeping Beauty","https://lorcana-api.com/images/aurora/lore_guardian/aurora-lore_guardian-large.png",4,true,"Aurora - Lore Guardian","Character",2,"Super Rare",,"Shift 2 (You may pay 2 {i} to play this on top of one of your characters named Aurora.)
Preserver: Opponents can't choose your items for abilities or effects.
Royal Inventory: {e} one of your items - Look at the top card of your deck and put it on either the top or the bottom of your deck.",3,3,"[""URS-140""]","Shift 2",,
"Rudy Hill","Storyborn, Villain","Sapphire","Raya and the Last Dragon","https://lorcana-api.com/images/dang_hu/talon_chief/dang_hu-talon_chief-large.png",5,true,"Dang Hu - Talon Chief","Character",2,"Rare","You can find villainy in the most unexpected places.","You Better Talk Fast: Your other Villain characters gain Support. (Whenever they quest, you may add their {s} to another chosen character's {s} this turn.)",5,3,"[""URS-142""]","Support",,
"Sarah Schmidt","Storyborn, Mentor","Sapphire","Mulan","https://lorcana-api.com/images/fa_li/mulan's_mother/fa_li-mulan's_mother-large.png",1,true,"Fa Li - Mulan's Mother","Character",1,"Common","When far from home, Mulan often thinks of her calming presence.",,3,1,"[""URS-143""]",,,
"James C Mulligan","Storyborn, Ally","Sapphire","The Little Mermaid","https://lorcana-api.com/images/flounder/collector's_companion/flounder-collector's_companion-large.png",3,true,"Flounder - Collector's Companion","Character",2,"Uncommon","""Ariel, Ariel! You won't believe what I found!""","Support (Whenever this character quests, you may add their {s} to another chosen character's {s} this turn.)
I'm Not a Guppy: If you have a character named Ariel in play, you may pay 1 {i} less to play this character.",2,2,"[""URS-144""]","Support",,
"Carlos Ruiz","Storyborn, Villain, Deity","Sapphire","Hercules","https://lorcana-api.com/images/hades/meticulous_plotter/hades-meticulous_plotter-large.png",4,true,"Hades - Meticulous Plotter","Character",1,"Uncommon","""This neat little scheme has Ursula's tentacles all over it. That sneaky sea witch... Wait! I can use this. She can keep those obnoxious Illumineers busy while I roll out my own plan.""",,6,3,"[""URS-145""]",,,
"Jake Murphy","Storyborn, Mentor, Queen","Sapphire","Frozen","https://lorcana-api.com/images/iduna/caring_mother/iduna-caring_mother-large.png",4,true,"Iduna - Caring Mother","Character",1,"Uncommon","""Come my darling, homeward bound
When all is lost, then all is found.""","Enduring Love: When this character is banished, you may put this card into your inkwell facedown and exerted.",3,3,"[""URS-147""]",,,
"Leonardo Giammichele","Dreamborn, Villain, Alien, Pirate, Captain","Sapphire","Treasure Planet","https://lorcana-api.com/images/john_silver/terror_of_the_realm/john_silver-terror_of_the_realm-large.png",8,true,"John Silver - Terror of the Realm","Character",3,"Rare","""Strange things be at the edge of the map: sea witches, entangled glimmers, and whatnot. I'll stay with me ship, thank you.""",,8,8,"[""URS-148""]",,,
"Lauren Levering","Floodborn, Ally","Sapphire","Frozen","https://lorcana-api.com/images/olaf/carrot_enthusiast/olaf-carrot_enthusiast-large.png",3,true,"Olaf - Carrot Enthusiast","Character",2,"Uncommon",,"Shift: Discard an item card (You may discard an item card to play this on top of one of your characters named Olaf.)
Carrots All Around!: Whenever he quests, each of your other characters gets +{s} equal to this character's {s} this turn.",4,1,"[""URS-149""]","Shift",,
"Brian Kesinger","Storyborn, Ally","Sapphire","Frozen","https://lorcana-api.com/images/olaf/trusting_companion/olaf-trusting_companion-large.png",1,true,"Olaf - Trusting Companion","Character",1,"Common","""Isn't this Kristoff's hat? If he went this way, he'll be caught in that storm!""","Support (Whenever this character quests, you may add their {s} to another chosen character's {s} this turn.)",2,1,"[""URS-150""]","Support",,
"Noukah","Storyborn, Ally","Sapphire","Tangled","https://lorcana-api.com/images/pascal/inquisitive_pet/pascal-inquisitive_pet-large.png",3,true,"Pascal - Inquisitive Pet","Character",1,"Common","If you want to find something hidden, get someone who's an expert at hiding.","Colorful Tactics: When you play this character, look at the top 3 cards of your deck and put them back in any order.",3,3,"[""URS-151""]",,,
"Mike Parker","Storyborn, Hero, Prince","Sapphire","Sleeping Beauty","https://lorcana-api.com/images/prince_phillip/gallant_defender/prince_phillip-gallant_defender-large.png",3,true,"Prince Phillip - Gallant Defender","Character",2,"Rare",,"Support (Whenever this character quests, you may add their {s} to another chosen character's {s} this turn.)
Best Defense: Whenever one of your characters is chosen for Support, they gain Resist +1 this turn. (Damage dealt to them is reduced by 1.)",3,1,"[""URS-152""]","Support, Resist +1",,
"Aubrey Archer","Dreamborn, Hero, Princess","Sapphire","Tangled","https://lorcana-api.com/images/rapunzel/appreciative_artist/rapunzel-appreciative_artist-large.png",5,true,"Rapunzel - Appreciative Artist","Character",3,"Rare","""Pascal! A new flower for the wall!""","Perceptive Partner: While you have a character named Pascal in play, this character gains Ward. (Opponents can't choose them except to challenge.)",5,3,"[""URS-153""]","Ward",,
"Kapik","Storyborn, Ally","Sapphire","The Little Mermaid","https://lorcana-api.com/images/scuttle/expert_on_humans/scuttle-expert_on_humans-large.png",2,true,"Scuttle - Expert on Humans","Character",1,"Uncommon","""Wow. This is special. This is very, very unusual.""","let Me See: When you play this character, look at the top 4 cards of your deck. You may reveal an item card and put it into your hand. Put the rest on the bottom of your deck in any order.",3,1,"[""URS-154""]",,,
"Roger P?rez / Hayley Evans","Storyborn, Hero, Deity, Dragon","Sapphire","Raya and the Last Dragon","https://lorcana-api.com/images/sisu/wise_friend/sisu-wise_friend-large.png",6,true,"Sisu - Wise Friend","Character",2,"Uncommon","""It may feel impossible, but sometimes, you just have to take the first step, even before you're ready.""",,6,6,"[""URS-155""]",,,
"Mel Milton","Dreamborn, Villain, Queen, Sorcerer","Sapphire","Snow White and the Seven Dwarfs","https://lorcana-api.com/images/the_queen/diviner/the_queen-diviner-large.png",3,true,"The Queen - Diviner","Character",1,"Legendary",,"Consult the Spellbook: {e} - Look at the top 4 cards of your deck. You may reveal an item card and put it into your hand. If that item costs 3 or less, you may play it for free instead and it enters play exerted. Put the rest on the bottom of your deck in any order.",3,3,"[""URS-156""]",,,
"James C Mulligan","Storyborn, Ally","Sapphire","The Beauty and the Beast","https://lorcana-api.com/images/transformed_chef/castle_stove/transformed_chef-castle_stove-large.png",4,true,"Transformed Chef - Castle Stove","Character",,"Common","""A good, hot meal will set you right as rain.""
 - Mrs. Potts","A Culinary Masterpiece: When you play this character, remove up to 2 damage from chosen character.",3,3,"[""URS-157""]",,,
"Erin Shin","Floodborn, King","Sapphire","The Little Mermaid","https://lorcana-api.com/images/triton/champion_of_atlantica/triton-champion_of_atlantica-large.png",9,true,"Triton - Champion of Atlantica","Character",3,"Legendary",,"Shift 6 (You may pay 6 {i} to play this on top of one of your characters named Triton.)
Imposing Presence: Opposing characters get -1 {s} for each location you have in play.",9,7,"[""URS-158""]","Shift 6",,
"Diogo Saito","Storyborn, King","Sapphire","The Little Mermaid","https://lorcana-api.com/images/triton/discerning_king/triton-discerning_king-large.png",3,false,"Triton - Discerning King","Character",1,"Rare","""If this is the only way, so be it.""","Consign to the Depths: {e}, Banish one of your items - Gain 3 lore.",3,3,"[""URS-159""]",,,
"Malia Ewart","Dreamborn, Prince","Sapphire","The Little Mermaid","https://lorcana-api.com/images/triton/young_prince/triton-young_prince-large.png",4,true,"Triton - Young Prince","Character",1,"Uncommon",,"Superior Swimmer: During your turn, this character gains Evasive. (They can challenge characters with Evasive.)
Keeper of Atlantica: Whenever one of your locations is banished, you may put that card into your inkwell facedown and exerted.",4,3,"[""URS-160""]","Evasive",,
"Oggy Christiansson","Storyborn, Ally","Sapphire","Raya and the Last Dragon","https://lorcana-api.com/images/tuk_tuk/curious_partner/tuk_tuk-curious_partner-large.png",2,true,"Tuk Tuk - Curious Partner","Character",1,"Common","""Some say he's easily distracted. They're not wrong...""
 - Raya",,3,2,"[""URS-161""]",,,
"Veronica Di Lorenzo / Livio Cacciatore",,"Sapphire","The Beauty and the Beast","https://lorcana-api.com/images/glean/glean-large.png",1,true,"Glean","Action",,"Common","""This could be just the thing I need to get my invention working.""","Banish chosen item. Its player gains 2 lore.",,,"[""URS-163""]",,,
"Rachel Elese",,"Sapphire","Sleeping Beauty","https://lorcana-api.com/images/seldom_all_they_seem/seldom_all_they_seem-large.png",2,true,"Seldom All They Seem","Action - Song",,"Common","I know you
I walked with you once upon a dream","(A character with cost 2 or more can {e} to sing this song for free.)
Chosen character gets -3 {s} this turn.",,,"[""URS-164""]",,,
"Matt Gaser",,"Sapphire","The Little Mermaid","https://lorcana-api.com/images/treasures_untold/treasures_untold-large.png",6,true,"Treasures Untold","Action - Song",,"Rare","How many wonders can one cavern hold?","(A character with cost 6 or more can {e} to sing this song for free.)
Return up to 2 item cards from your discard into your hand.",,,"[""URS-165""]",,,
"Mariana Moreno",,"Sapphire","Frozen","https://lorcana-api.com/images/field_of_ice/field_of_ice-large.png",3,true,"Field of Ice","Item",,"Rare",,"Icy Defense: Whenever your play a character, they gain Resist +1 until the start of your next turn. (Damage dealt to them is reduced by 1.)",,,"[""URS-166""]","Resist +1",,
"Ryan Bittner",,"Sapphire","Mulan","https://lorcana-api.com/images/giant_stone_dragon/giant_stone_dragon-large.png",3,true,"Great Stone Dragon","Item",,"Uncommon",,"Asleep: This item enters play exerted.
Awaken: {e} - Put a character card from your discard into your inkwell facedown and exerted.",,,"[""URS-167""]",,,
"Gregor Krysinski",,"Sapphire","Frozen","https://lorcana-api.com/images/ice_block/ice_block-large.png",1,false,"Ice Block","Item",,"Common","Frozen ink can be harvested and processed to many useful ends.","Chilly Labor: {e} - Chosen character gets -1 {s} this turn.",,,"[""URS-168""]",,,
"Jeremy Adams",,"Sapphire","The Little Mermaid","https://lorcana-api.com/images/ariel's_grotto/a_secret_place/ariel's_grotto-a_secret_place-large.png",2,true,"Ariel's Grotto - A Secret Place","Location",0,"Rare",,"Treasure Trove: While you have 3 or more items in play, this location gets +2 {l}.",7,,"[""URS-169""]",,,2
"Elodie Mondoloni",,"Sapphire","Mulan","https://lorcana-api.com/images/winter_camp/medical_tent/winter_camp-medical_tent-large.png",3,true,"Winter Camp - Medical Tent","Location",1,"Common",,"Help the Wounded: Whenever a character quests while here, remove up to 2 damage from them. If they're a Hero character, remove up to 4 damage instead.",8,,"[""URS-170""]",,,1
"Randy Bishop","Floodborn, Hero","Steel","Aladdin","https://lorcana-api.com/images/aladdin/brave_rescuer/aladdin-brave_rescuer-large.png",3,true,"Aladdin - Brave Rescuer","Character",1,"Uncommon",,"Shift: Discard a location card (You may discard a location card to play this on top of one of your characters named Aladdin.)
Crashing Though: Whenever this character quests, you may banish chosen item.",3,3,"[""URS-171""]","Shift",,
"Randy Bishop","Storyborn, Hero","Steel","Aladdin","https://lorcana-api.com/images/aladdin/resolute_swordsman/aladdin-resolute_swordsman-large.png",1,true,"Aladdin - Resolute Swordsman","Character",1,"Common","""How about we cut to the part where I make a quick escape and you yell after me? No? Can't say I didn't give you a chance.""",,3,1,"[""URS-172""]",,,
"Alice Pisoni","Storyborn, Titan","Steel","Hercules","https://lorcana-api.com/images/arges/the_cyclops/arges-the_cyclops-large.png",2,true,"Arges - The Cyclops","Character",1,"Common","""Looks like you got some big feelings there, buddy - let's stomp 'em out!""
 -Hades",,3,3,"[""URS-173""]",,,
"Simangaliso Sibaya","Storyborn, Hero, Prince","Steel","The Beauty and the Beast","https://lorcana-api.com/images/beast/thick-skinned/beast-thick-skinned-large.png",3,true,"Beast - Thick-Skinned","Character",1,"Common","He's even tougher than he looks.","Resist +1 (Damage dealt to this character is reduced by 1.)",3,2,"[""URS-176""]","Resist +1",,
"Gaku Kumatori","Storyborn, Ally","Steel","Mulan","https://lorcana-api.com/images/chi/fu-imperial_advisor/chi-fu-imperial_advisor-large.png",3,true,"Chi-Fu - Imperial Advisor","Character",1,"Uncommon","""You there! Keep that fighting away from here! It is imperative that I write to the Emperor.""","Overly Cautious: While this character has no damage, he gets +2{l}.",5,0,"[""URS-177""]",,,
"Michela Cacciatore / Giulia Priori","Storyborn, Ally","Steel","Mulan","https://lorcana-api.com/images/chien/po-imperial_soldier/chien-po-imperial_soldier-large.png",5,true,"Chien-Po - Imperial Soldier","Character",1,"Common",,"Bodyguard (This character may enter play exerted. An opposing character who challenges one of your characters must choose one with Bodyguard if able.)",7,4,"[""URS-178""]","Bodyguard",,
"Federico M. Cugliari","Dreamborn, Hero, Pirate, Captain","Steel","Duck Tales","https://lorcana-api.com/images/donald_duck/buccaneer/donald_duck-buccaneer-large.png",4,true,"Donald Duck - Buccaneer","Character",1,"Legendary","Nobody stands a change against the daring duck of the high seas!","Boarding Party: During your turn, whenever this character banishes a character in a challenge, your other characters get +1 {l} this turn.",4,3,"[""URS-179""]",,,
"Kendall Hale","Dreamborn, Ally","Steel","The Beauty and the Beast","https://lorcana-api.com/images/lefou/opportunistic_flunky/lefou-opportunistic_flunky-large.png",3,true,"Lefou - Opportunistic Flunky","Character",1,"Rare",,"I Learned From the Best: During your turn, you may play this character for free if an opposing character was banished in a challenge this turn.",3,2,"[""URS-181""]",,,
"Michela Cacciatore / Giulia Priori","Storyborn, Ally","Steel","Mulan","https://lorcana-api.com/images/ling/imperial_soldier/ling-imperial_soldier-large.png",3,true,"Ling - Imperial Soldier","Character",1,"Uncommon","A good friend is handy in a fight.","Full of Spirit: Your Hero characters get +1{s}.",3,3,"[""URS-183""]",,,
"Samanta Erdini","Storyborn, Ally, Madrigal","Steel","Encanto","https://lorcana-api.com/images/luisa_madrigal/rock_of_the_family/luisa_madrigal-rock_of_the_family-large.png",3,true,"Luisa Madrigal - Rock of the Family","Character",1,"Common","There's no way Ursula's creatures are getting to that donkey.","I'm the Strong One: While you have another character in play, this character gets +2{s}.",4,2,"[""URS-184""]",,,
