"Artist","Classifications","Color","Franchise","Image","Cost","Inkable","Name","Type","Lore","Rarity","Flavor_Text","Body_Text","Willpower","Strength","prints","Abilities","Card_Variants","Move_Cost"
"Valentina Graziuso","Storyborn, Ally","Emerald","","https://api.lorcana.ravensburger.com/images/en/set9/91_ac72a8556d6bd4fc61a690f521cb3b773ad496c9.jpg",3,true,"Wildcat - Mechanic","Character",1,"Uncommon","""I can take anything apart in under five minutes!""","Evasive (Only characters with Evasive can
challenge this character.)
DISASSEMBLE {e} - Banish chosen item.",3,2,"[""FAB-091"",""INK-092""]",,,
"Lauren Walsh","Storyborn, Hero, Prince","Emerald","","https://api.lorcana.ravensburger.com/images/en/set9/92_aae614348723ba681c877c8e5b501dfb14286544.jpg",2,true,"Aladdin - Prince Ali","Character",1,"Common","Fabulously wealthy. Practically untouchable.
Genuinely inauthentic.","Ward (Opponents can't choose this character
except to challenge.)",2,2,"[""FAB-092"",""TFC-069""]",,,
"Lissette Carrera","Dreamborn, Ally","Emerald","","https://api.lorcana.ravensburger.com/images/en/set9/93_c197c9ff352a793ed680de94ecd39c6476971303.jpg",4,true,"Daisy Duck - Secret Agent","Character",2,"Uncommon","","THWART: Whenever this character quests, each
opponent chooses and discards a card.",3,2,"[""FAB-093"",""ROF-076""]",,,
"Raquel Villanueva","Song","Emerald","","https://api.lorcana.ravensburger.com/images/en/set9/94_54140617cef40bc6aa27978087ae66524e8fcffa.jpg",3,true,"Stand Out","Action",,"Uncommon","","(A character with cost 3 or more can {e} to sing this
song for free.)
Chosen character gets +3 {s} and gains Evasive until
the start of your next turn. (Only characters with
Evasive can challenge them.)",,,"[""FAB-094""]",,,
"Giulia Riva","Song","Emerald","","https://api.lorcana.ravensburger.com/images/en/set9/95_764fb1a97ec5db32d9eac0076ad8f6bceb21c88a.jpg",2,true,"Sudden Chill","Action",,"Common","Cruella De Vil, Cruella De Vil
If she doesn't scare you, no evil thing will","(A character with cost 2 or more can {e} to sing this
song for free.)
Each opponent chooses and discards a card.",,,"[""FAB-095"",""TFC-098""]",,,
"Man? Kandalyan / Anna Stosik","","Emerald","","https://api.lorcana.ravensburger.com/images/en/set9/96_c6a0e25beee8b9938910c45d994abbff83d0f7e6.jpg",1,true,"Improvise","Action",,"Common","Shan-Yu: ""It looks like you're out of ideas.""
Mulan: ""Not quite!""","Chosen character gets +1 {s} this turn. Draw a card.",,,"[""FAB-096"",""ROF-099""]",,,
"Dylan Bonner","Song","Emerald","","https://api.lorcana.ravensburger.com/images/en/set9/97_6b5fa45d1183bdcf1f6f503450e0f3248fcf35ae.jpg",8,false,"Under the Sea","Action",,"Rare","Such wonderful things surround you","Sing Together 8 (Any number of your or your teammates'
characters with total cost 8 or more may {e} to sing this song
for free.)
Put all opposing characters with 2 {s} or less on the bottom of
their players' decks in any order.",,,"[""FAB-097"",""URS-095""]",,,
"Elodie Mondoloni","","Emerald","","https://api.lorcana.ravensburger.com/images/en/set9/98_7bcf349759748306e088cda851f1cb726e548a52.jpg",2,false,"Make the Potion","Action",,"Common","","Choose one:
- Banish chosen item.
- Deal 2 damage to chosen damaged character.",,,"[""FAB-098"",""URS-094""]",,,
"Rosa la Barbera / Leonardo Giammichele","Song","Emerald","","https://api.lorcana.ravensburger.com/images/en/set9/99_86cab1371cb474ec9d43ce5a82405faef6f9b018.jpg",3,false,"Mother Knows Best","Action",,"Uncommon","One way or another
Something will go wrong, I swear","(A character with cost 3 or more can {e} to sing this
song for free.)
Return chosen character to their player's hand.",,,"[""FAB-099"",""TFC-095""]",,,
"Carlos Ruiz","","Emerald","","https://api.lorcana.ravensburger.com/images/en/set9/100_c4fb8e795729deb858e86cc421548b30e48caa09.jpg",2,true,"Family Fishing Pole","Item",,"Rare","","WATCH CLOSELY: This item enters play exerted.
THE PERFECT CAST {e}, 1 {i}, Banish this item -
Return chosen exerted character of yours to your
hand to gain 2 lore.",,,"[""FAB-100""]",,,
"Andrew Pe?a","","Emerald","","https://api.lorcana.ravensburger.com/images/en/set9/101_9e623571c03d309a9de57013ea7688a8853745ea.jpg",2,true,"Signed Contract","Item",,"Uncommon","""I would love to help you, of course, but there's the little
matter of the contract...""
-Ursula","FINE PRINT: Whenever an opponent plays a song, you
may draw a card.",,,"[""FAB-101"",""URS-099""]",,,
"Roberto Gatto","","Emerald","","https://api.lorcana.ravensburger.com/images/en/set9/102_82672376ee9d225b984b56cb5ddc271f5b913f5a.jpg",1,true,"Hidden Cove - Tranquil Haven","Location",0,"Common","""Flounder, this is perfect! I can't wait to explore it.""
-Ariel","REVITALIZING WATERS: Characters get +1 {s} and +1 {w} while here.",6,,"[""FAB-102"",""URS-101""]",,,
"Gaku Kumatori","Dreamborn, Ally","Ruby","","https://api.lorcana.ravensburger.com/images/en/set9/103_b203c807dbb05ff3a0deb6b40bfce6f9a1a76f65.jpg",2,true,"LeFou - Instigator","Character",1,"Uncommon","All a mob needs is a push in the wrong direction.","FAN THE FLAMES: When you play this character,
ready chosen character. They can't quest for the
rest of this turn.",2,2,"[""FAB-103""]",,,
"M. Robert Davies / L. Giammichele","Storyborn, Villain","Ruby","","https://api.lorcana.ravensburger.com/images/en/set9/104_668c2e0c58a18ce0b1cf0eb2b3f6a532a836e654.jpg",3,true,"Shere Khan - Menacing Predator","Character",1,"Rare","The sixth Rule of Villainy: Keep your mind sharp
and your claws sharper.","DON'T INSULT MY INTELLIGENCE: Whenever one
of your characters challenges another character,
gain 1 lore.",3,3,"[""FAB-104"",""ROF-126""]",,,
"Oggy Christiansson","Storyborn, Hero, Prince","Ruby","","https://api.lorcana.ravensburger.com/images/en/set9/105_6bdaf56d97e9b602e91d72552c4fca1a3b8313d0.jpg",2,false,"Simba - Scrappy Cub","Character",3,"Rare","He'll join the hunt for lore after he's had a quick
snack.","",1,1,"[""FAB-105"",""INK-123""]",,,
"Sandara Tang","Storyborn, Hero, Deity","Ruby","","https://api.lorcana.ravensburger.com/images/en/set9/106_f21a60c416f514bd7c4494c14cbb0204956a82aa.jpg",7,true,"Maui - Whale","Character",1,"Rare","Always ready to make a splash.","THIS MISSION IS CURSED: This character can't
ready at the start of your turn.
I GOT YOUR BACK 2 {i} - Ready this character.
He can't quest for the rest of this turn.",8,8,"[""FAB-106"",""INK-114""]",,,
"Javi Salas","Dreamborn, Hero, Princess","Ruby","","https://api.lorcana.ravensburger.com/images/en/set9/107_7bd66c5d93ee758d53ab7ce11999a690797d07f9.jpg",3,true,"Ariel - Adventurous Collector","Character",1,"Super Rare","Shipwrecks are great places to find lore-and hide from sharks!","Evasive (Only characters with Evasive can challenge this
character.)
INSPIRING VOICE Whenever you play a song, chosen
character of yours gains Evasive until the start of your
next turn.",3,2,"[""FAB-107"",""INK-103""]",,,
"Luis Huerta","Storyborn, Villain, Dragon","Ruby","","https://api.lorcana.ravensburger.com/images/en/set9/108_ec771c5ac3260cde84bb220fd3351e08ed6b7cb1.jpg",9,true,"Maleficent - Monstrous Dragon","Character",2,"Legendary","The ninth Rule of Villainy: When all else fails,
turn into a dragon.","DRAGON FIRE: When you play this character,
you may banish chosen character.",5,7,"[""FAB-108"",""TFC-113""]",,,
"Stefano Spagnuolo","Storyborn","Ruby","","https://api.lorcana.ravensburger.com/images/en/set9/109_a462af51d48b88ab01018a66347f20ef8c20c9f5.jpg",2,true,"Powerline - Taking the Stage","Character",1,"Common","""Goin' to the Powerline concert. Ah! It's unbelievable, man.""
-P.J. Pete","Singer 4 (This character counts as cost 4 to sing songs.)",2,3,"[""FAB-109""]",,,
"Nicholas Kole","Floodborn","Ruby","","https://api.lorcana.ravensburger.com/images/en/set9/110_c7127177487cdda1b4001c75e41b6cba8e0c5f73.jpg",6,true,"Powerline - World's Greatest Rock Star","Character",2,"Super Rare","","Shift 4 {i} (You may pay 4 {i} to play this on top of one of
your characters named Powerline.)
Singer 9
MASH-UP Once during your turn, whenever this character
sings a song, look at the top 4 cards of your deck. You may
reveal a song card with cost 9 or less and play it for free.
Put the rest on the bottom of your deck in any order.",4,6,"[""FAB-110""]",,,
"Cristian Romero","Floodborn, Hero, Prince","Ruby","","https://api.lorcana.ravensburger.com/images/en/set9/111_fc83a63669bace91d4de7d711d22c3ed67f3afa8.jpg",3,true,"Mickey Mouse - Brave Little Prince","Character",1,"Legendary","","Shift 5 {i} (You may pay 5 {i} to play this on top of one of
your characters named Mickey Mouse.)
Evasive (Only characters with Evasive can challenge this
character.)
CROWNING ACHIEVEMENT While this character has a card
under him, he gets +3 {s}, +3 {w}, and +3 {l}.",2,2,"[""FAB-111""]",,,
"Stefano Spagnuolo","Storyborn, Hero","Ruby","","https://api.lorcana.ravensburger.com/images/en/set9/112_65f02407a175b1d793474baa84e5cce8d81b4524.jpg",3,true,"Max Goof - Rockin' Teen","Character",1,"Common","","Singer 5 (This character counts as cost 5 to
sing songs.)
I JUST WANNA STAY HOME This character can't
move to locations.",3,4,"[""FAB-112""]",,,
"Carlos Ruiz","Storyborn, Ally","Ruby","","https://api.lorcana.ravensburger.com/images/en/set9/113_be1d05ec2fc69763b9716ed6973d819b1d971f91.jpg",2,true,"Roxanne - Powerline Fan","Character",1,"Uncommon","","CONCERT LOVER: While you have a character with
Singer in play, this character gets +1 {s} and +1 {l}.",3,2,"[""FAB-113""]",,,
"Kenneth Anderson","Storyborn, Ally","Ruby","","https://api.lorcana.ravensburger.com/images/en/set9/114_54357d6be49e2e8e6f44984480daaed0cab0fd0f.jpg",4,true,"P.J. Pete - Caught Up in the Music","Character",1,"Common","He's a real music buff.","SHOUT OUT LOUD!: Whenever you play a song, this
character gets +2 {s} this turn.",5,3,"[""FAB-114""]",,,
"Matthew Robert Davies","Storyborn, Villain","Ruby","","https://api.lorcana.ravensburger.com/images/en/set9/115_c926d71cf3d72b9846e7266f135db78ac0ba9f9c.jpg",2,true,"Gaston - Arrogant Hunter","Character",0,"Common","It's not arrogance when you really are the best.","Reckless (This character can't quest and must
challenge each turn if able.)",2,4,"[""FAB-115"",""TFC-110""]",,,
"Mila Useche","Storyborn, Hero, Princess","Ruby","","https://api.lorcana.ravensburger.com/images/en/set9/116_ab847817f135d38017d33ee644893982f5895532.jpg",4,true,"Moana - Undeterred Voyager","Character",1,"Common","No fire or storm will keep her from her goal.","Evasive (Only characters with Evasive can
challenge this character.)",4,3,"[""FAB-116"",""INK-117""]",,,
"Kenneth Anderson","Storyborn","Ruby","","https://api.lorcana.ravensburger.com/images/en/set9/117_905695d3a5f58f37eb5c2ef4d771b2710cc48f7c.jpg",3,true,"Powerline - Musical Superstar","Character",1,"Rare","""For the first time ever, we're seeing it eye to eye.""","ELECTRIC MOVE: If you've played a song this turn,
this character gains Rush this turn. (They can
challenge the turn they're played.)",3,4,"[""FAB-117""]",,,
"LadyShalirin","Storyborn, Hero, Deity, Dragon","Ruby","","https://api.lorcana.ravensburger.com/images/en/set9/118_0dd12ab6fa9630ca862c95e09ab99be4b029319b.jpg",3,true,"Sisu - Emboldened Warrior","Character",2,"Rare","Sometimes the only way to fight the unimaginable
is with the incredible.","SURGE OF POWER: This character gets +1 {s} for
each card in opponents' hands.",4,1,"[""FAB-118"",""URS-124""]",,,
"Otto Paredes","Storyborn, Hero, Deity, Dragon","Ruby","","https://api.lorcana.ravensburger.com/images/en/set9/119_71bc91b40501f7a6352aad42c413dc10d51c4096.jpg",3,false,"Sisu - Daring Visitor","Character",1,"Uncommon","""Come on-what's the worst that can happen?""","Evasive (Only characters with Evasive can challenge
this character.)
BRING ON THE HEAT! When you play this character,
banish chosen opposing character with 1 {s} or less.",1,1,"[""FAB-119"",""URS-123""]",,,
"Isaiah Mesq","Floodborn, Villain, Queen","Ruby","","https://api.lorcana.ravensburger.com/images/en/set9/120_62c5ff5cd323851bf7dbb3d2f2dacc803d3c78b3.jpg",5,true,"Queen of Hearts - Sensing Weakness","Character",1,"Uncommon","","Shift 2 {i} (You may pay 2 {i} to play this on top of
one of your characters named Queen of Hearts.)
LET THE GAME BEGIN Whenever one of your
characters challenges another character, you may
draw a card.",3,4,"[""FAB-120""]",,,
"Valentin Palombo","Dreamborn, Ally","Ruby","","https://api.lorcana.ravensburger.com/images/en/set9/121_2b6772d14507dee21b5b557aab9f9e2a7ade98a5.jpg",2,true,"Lumiere - Fiery Friend","Character",1,"Rare","""The invaders are at our gates, mes amis! It's time to
show them what we're made of.""","FERVENT ADDRESS: Your other characters get +1 {s}.",2,2,"[""FAB-121"",""URS-113""]",,,
"Bill Robinson","Storyborn, Ally","Ruby","","https://api.lorcana.ravensburger.com/images/en/set9/122_2461c86b4ce62f202cf40119b41dd132eea7388a.jpg",5,true,"Card Soldiers - Full Deck","Character",2,"Uncommon","You'll have to deal with them sooner or later.","",5,5,"[""FAB-122"",""ROF-105""]",,,
"Valerio Buonfantino","Storyborn, Villain, Queen","Ruby","","https://api.lorcana.ravensburger.com/images/en/set9/123_728d83ddabe527d620cde9716db015dee9906a74.jpg",2,true,"Queen of Hearts - Impulsive Ruler","Character",1,"Common","The glow of lore in the flood caught her eye.
""The spellbook!"" she cried. ""Don't let it get away!""","Rush (This character can challenge the turn
they're played.)",2,2,"[""FAB-123""]",,,
"Clio Wolfensberger","Dreamborn, Hero, Princess","Ruby","","https://api.lorcana.ravensburger.com/images/en/set9/124_4ee9c5073412f6555e6d555a10c17bcb65cda977.jpg",6,false,"Rapunzel - Letting Down Her Hair","Character",2,"Common","""Who are you? And how did you find me?""","TANGLE: When you play this character, each
opponent loses 1 lore.",4,5,"[""FAB-124"",""TFC-121""]",,,
"Jared Mathews","Storyborn, Hero, Princess","Ruby","","https://api.lorcana.ravensburger.com/images/en/set9/125_204d4d557ce67ce8a989cfa68e8e712c9697d8c0.jpg",1,true,"Mulan - Injured Soldier","Character",1,"Common","She'll never give up.","BATTLE WOUND: This character enters play with
2 damage.",3,2,"[""FAB-125"",""URS-116""]",,,
"Nicola Saviori","Floodborn, Hero, Princess","Ruby","","https://api.lorcana.ravensburger.com/images/en/set9/126_cec881d47a9fd8b76061d5a163692906340e8387.jpg",6,true,"Mulan - Elite Archer","Character",2,"Super Rare","","Shift 5 {i} (You may pay 5 {i} to play this on top of one of your
characters named Mulan.)
STRAIGHT SHOOTER When you play this character, if you
used Shift to play her, she gets +3 {s} this turn.
TRIPLE SHOT During your turn, whenever this character
deals damage to another character in a challenge, deal the
same amount of damage to up to 2 other chosen characters.",6,2,"[""FAB-126"",""URS-114""]",,,
"Amber Kommavongsa","Storyborn, Hero, Princess","Ruby","","https://api.lorcana.ravensburger.com/images/en/set9/127_7c3c2cd47e5b2781040baa8e9d23b00f06b4878b.jpg",3,true,"Raya - Headstrong","Character",1,"Common","Two parts bravery, one part cleverness, and a whole
lot of determination.","NOTE TO SELF, DON'T DIE: During your turn, whenever
this character banishes another character in a
challenge, you may ready this character. If you do,
she can't quest for the rest of this turn.",3,2,"[""FAB-127"",""ROF-122""]",,,
"Cory Godbey","Storyborn, Ally","Ruby","","https://api.lorcana.ravensburger.com/images/en/set9/128_553536d699e33f3f41769e9a8f79152d15f2e9f8.jpg",1,true,"Sergeant Tibbs - Courageous Cat","Character",1,"Common","""Yes, sir. Righto, sir. Right away, sir!""","",2,2,"[""FAB-128"",""TFC-124""]",,,
"Sandra Rios","Storyborn, Ally","Ruby","","https://api.lorcana.ravensburger.com/images/en/set9/129_8afeeec4597153c25008d0eea2b5e354ae0dcf50.jpg",3,true,"Tuk Tuk - Lively Partner","Character",1,"Uncommon","","Evasive (Only characters with Evasive can challenge this
character.)
ON A ROLL When you play this character, you may
move him and one of your other characters to the
same location for free. If you do, the other character
gets +2 {s} this turn.",3,2,"[""FAB-129"",""URS-127""]",,,
"Eri Welli","Song","Ruby","","https://api.lorcana.ravensburger.com/images/en/set9/130_dd958c2002139344b9e23e2a7f4c0d957aefa268.jpg",9,true,"I2I","Action",,"Rare","","Sing Together 9 (Any number of your or your teammates'
characters with total cost 9 or more may {e} to sing this song
for free.)
Each player draws 2 cards and gains 2 lore. If 2 or more
characters sang this song, ready them. They can't quest for
the rest of this turn.",,,"[""FAB-130""]",,,
"Eva Widermann","Song","Ruby","","https://api.lorcana.ravensburger.com/images/en/set9/131_4a9a537b8febce78f32188537e642feb1254d8cb.jpg",2,true,"You Can Fly!","Action",,"Common","","(A character with cost 2 or more can {e} to sing this
song for free.)
Chosen character gains Evasive until the start of
your next turn. (Only characters with Evasive can
challenge them.)",,,"[""FAB-131"",""ROF-133""]",,,
"Valentina Graziuso","Song","Ruby","","https://api.lorcana.ravensburger.com/images/en/set9/132_21518e470242915f38f67cd742b05b4d71202a36.jpg",6,true,"A Pirate's Life","Action",,"Uncommon","Give me a career
As a buccaneer","Sing Together 6 (Any number of your or your teammates'
characters with total cost 6 or more may {e} to sing this song
for free.)
Each opponent loses 2 lore. You gain 2 lore.",,,"[""FAB-132"",""URS-128""]",,,
"Emily Abeydeera","Song","Ruby","","https://api.lorcana.ravensburger.com/images/en/set9/133_435642c246b2f0e21dc7c73ca94c0e865b90f8ef.jpg",4,false,"Be King Undisputed","Action",,"Uncommon","Respected, saluted","(A character with cost 4 or more can {e} to sing this
song for free.)
Each opponent chooses and banishes one of their
characters.",,,"[""FAB-133"",""URS-129""]",,,
"Defne T?z?m","","Ruby","","https://api.lorcana.ravensburger.com/images/en/set9/134_05bf0c1cd177509a45c5a0ce4fc3ccfe2aa433ea.jpg",2,true,"Medallion Weights","Item",,"Uncommon","","DISCIPLINE AND STRENGTH: {e}, 2 {i} - Chosen
character gets +2 {s} this turn. Whenever they
challenge another character this turn, you may
draw a card.",,,"[""FAB-134"",""URS-132""]",,,
"Peter Brockhammer","","Ruby","","https://api.lorcana.ravensburger.com/images/en/set9/135_f57439d4f68abddf7f86217f907190d96a6f8fb7.jpg",4,false,"Dinner Bell","Item",,"Rare","The delicate sound of impending doom.","YOU KNOW WHAT HAPPENS: {e}, 2 {i} - Draw cards
equal to the damage on chosen character of yours,
then banish them.",,,"[""FAB-135"",""ROF-134""]",,,
"Kaitlin Cuthbertson","","Ruby","","https://api.lorcana.ravensburger.com/images/en/set9/136_c00a609b5ba7b67ebf7c0386809f8a71f789cb82.jpg",3,true,"Agrabah - Marketplace","Location",2,"Common","""Welcome to Agrabah, city of mystery, of enchantment, and the finest merchandise this
side of the river.""
-Merchant","",5,,"[""FAB-136"",""INK-134""]",,,
"Leonardo Giammichele","Dreamborn, Hero, Queen, Knight","Sapphire","","https://api.lorcana.ravensburger.com/images/en/set9/137_0486f6e953608cae1846553de65c347aeec58b7d.jpg",4,true,"Anna - True-Hearted","Character",2,"Rare","Make sure you know what's truly important and be
willing to fight for it.","LET ME HELP YOU: Whenever this character
quests, your other Hero characters get +1 {l}
this turn.",4,2,"[""FAB-137"",""URS-138""]",,,
"Federico Maria Cugliari","Dreamborn, Ally","Sapphire","","https://api.lorcana.ravensburger.com/images/en/set9/138_4f3fd67e8b4eabb587e94d25e143946a9306ddab.jpg",2,true,"Huey - Savvy Nephew","Character",1,"Rare","""This looks like part of a larger crystal!""","Support (Whenever this character quests, you may add
their {s} to another chosen character's {s} this turn.)
THREE NEPHEWS Whenever this character quests, if you
have characters named Dewey and Louie in play, you
may draw 3 cards.",2,2,"[""FAB-138"",""INK-145""]",,,
"Federico Maria Cugliari","Dreamborn, Ally","Sapphire","","https://api.lorcana.ravensburger.com/images/en/set9/139_d91488690dd6081427f01829235d06faf9146677.jpg",3,true,"Dewey - Showy Nephew","Character",2,"Uncommon","""I got it! I knew I could do it! Dewey for the win!""","Support (Whenever this character quests, you
may add their {s} to another chosen character's
{s} this turn.)",3,2,"[""FAB-139"",""INK-139""]",,,
"Federico Maria Cugliari","Dreamborn, Ally","Sapphire","","https://api.lorcana.ravensburger.com/images/en/set9/140_98c4ba8cd7c006f9c28e169bb7bc66afce6dc484.jpg",4,true,"Louie - Chill Nephew","Character",2,"Common","""Found the last one!""","Support (Whenever this character quests, you
may add their {s} to another chosen character's
{s} this turn.)",4,3,"[""FAB-140"",""INK-149""]",,,
"Ellie Horie","Storyborn, Hero","Sapphire","","https://api.lorcana.ravensburger.com/images/en/set9/141_341c433864a4ce43b4a054dc092428e185b90f44.jpg",4,true,"Alice - Accidentally Adrift","Character",2,"Rare","","WASHED AWAY: When you play this character,
you may put chosen item into its player's inkwell
facedown and exerted.
MAKING WAVES Whenever this character quests,
chosen opposing character gets -2 {s} this turn.",3,2,"[""FAB-141""]",,,
"LadyShalirin","Storyborn, Hero, Princess","Sapphire","","https://api.lorcana.ravensburger.com/images/en/set9/142_7a23d28ca4130be640d497658c73253c8946a3ed.jpg",5,true,"Mulan - Considerate Diplomat","Character",2,"Super Rare","","IMPERIAL INVITATION: Whenever this character
quests, look at the top 4 cards of your deck. You
may reveal a Princess character card and put it
into your hand. Put the rest on the bottom of your
deck in any order.",5,3,"[""FAB-142""]",,,
"Juan Diego Le?n","Storyborn, Villain","Sapphire","","https://api.lorcana.ravensburger.com/images/en/set9/143_4630767f9b0648ce25e687f7ad885e4efd4baa8a.jpg",3,false,"Cruella De Vil - Style Icon","Character",1,"Legendary","","OUT OF SEASON: Once during your turn, whenever
a character with cost 2 or less is banished, put the
top card of your deck into your inkwell facedown
and exerted.
INSULTING REMARK During your turn, each opposing
character with cost 2 or less gets -1 {s}.",3,2,"[""FAB-143""]",,,
"Luis Huerta","Storyborn, Mentor, King","Sapphire","","https://api.lorcana.ravensburger.com/images/en/set9/144_3d386eaca19d546f059156d1c15bec484782c647.jpg",6,true,"Mufasa - King of the Pride Lands","Character",3,"Common","""A king must care for all of the creatures in his
kingdom, no matter their size.""","",6,4,"[""FAB-144"",""TFC-155""]",,,
"Aisha Durmagambetova","Dreamborn, Villain","Sapphire","","https://api.lorcana.ravensburger.com/images/en/set9/145_e7b48b7d4ed607b7d5844843f059d5e64bc7ff82.jpg",2,true,"Cruella De Vil - Fashionable Cruiser","Character",1,"Common","""Isn't it just gorgeous, darling? And just as stylish
as I am.""","NOW GET GOING: During your turn, this character
gains Evasive. (They can challenge characters
with Evasive.)",2,3,"[""FAB-145"",""ROF-144""]",,,
"Maria Dresden","Storyborn, Hero, Queen","Sapphire","","https://api.lorcana.ravensburger.com/images/en/set9/146_ed628e7be9264fca6b00dfde8a714a38abb329fe.jpg",2,true,"Anna - Braving the Storm","Character",1,"Common","After talking to Olaf, Anna marched into the
unexpected storm to save Kristoff.","I WAS BORN READY While you have another Hero
character in play, this character gets +1 {l}.",4,1,"[""FAB-146"",""URS-137""]",,,
"Brian Weisz","Storyborn, Ally","Sapphire","","https://api.lorcana.ravensburger.com/images/en/set9/147_1e9311ecb31148322787ebc9fcc98e5b7817af91.jpg",1,true,"Flounder - Voice of Reason","Character",1,"Common","""Excitement...adventure...danger lurking
around every cor- AAAAAGGH!""","",2,2,"[""FAB-147""]",,,
"Dustin Panzino / Leonardo Giammichele","Storyborn, Villain, Prince","Sapphire","","https://api.lorcana.ravensburger.com/images/en/set9/148_d72b05de5735783c233ba91810bcdabd71b4dd85.jpg",3,true,"Hans - Noble Scoundrel","Character",2,"Common","Hans was confident he could bring Anna to Ursula-
all he needed was something of Kristoff's to lure her in.","ROYAL SCHEMES: When you play this character, if a
Princess or Queen character is in play, gain 1 lore.",2,3,"[""FAB-148"",""URS-146""]",,,
"Jennifer Gheduzzi / Livio Cacciatore","Storyborn, Villain, Queen, Sorcerer","Sapphire","","https://api.lorcana.ravensburger.com/images/en/set9/149_070547b24760c4078c903ee170103e30a016af0d.jpg",4,true,"The Queen - Mirror Seeker","Character",1,"Uncommon","She has only one question, and she'd better like
the answer.","CALCULATING AND VAIN: Whenever this character
quests, you may look at the top 3 cards of your
deck and put them back in any order.",5,2,"[""FAB-149"",""INK-156""]",,,
"Juan Diego Le?n","Storyborn, Mentor","Sapphire","","https://api.lorcana.ravensburger.com/images/en/set9/150_37ca10e2a085d053274fc0ed90dda7dd9fd9fe8f.jpg",7,false,"Grand Pabbie - Oldest and Wisest","Character",3,"Rare","When he talks, even the sky listens.","ANCIENT INSIGHT: Whenever you remove 1 or
more damage from one of your characters,
gain 2 lore.",6,3,"[""FAB-150""]",,,
"Matthew Robert Davies","Dreamborn, Villain, Deity","Sapphire","","https://api.lorcana.ravensburger.com/images/en/set9/151_5bba92401fe041adc7648524da9db3f71adff1a5.jpg",7,false,"Hades - Infernal Schemer","Character",2,"Legendary","""He's gotta have a weakness, because everybody's
got a weakness.""","IS THERE A DOWNSIDE TO THIS?: When you play
this character, you may put chosen opposing
character into their player's inkwell facedown.",6,3,"[""FAB-151"",""TFC-147""]",,,
"Rogie Custodio / Erin Shin","Storyborn, Mentor","Sapphire","","https://api.lorcana.ravensburger.com/images/en/set9/152_86dfa0703ecb4468c148c073d022ce9da631126b.jpg",3,false,"Mama Odie - Mystical Maven","Character",1,"Rare","""You dig a little deeper, you'll find everything you need.""","THIS GOING TO BE GOOD: Whenever you play a song,
you may put the top card of your deck into your inkwell
facedown and exerted.",3,1,"[""FAB-152"",""INK-151""]",,,
