"Artist","Classifications","Color","Franchise","Image","Cost","Inkable","Name","Type","Lore","Rarity","Flavor_Text","Body_Text","Willpower","Strength","prints","Abilities","Card_Variants","Move_Cost"
"Hedvig H-S","Storyborn, Hero, Queen, Sorcerer","Amethyst","","https://api.lorcana.ravensburger.com/images/en/set8/60_7b15000c8441a16a5078f04ec514d1d304b3aad6.jpg",4,true,"Elsa - Fierce Protector","Character",1,"Rare","""I have to protect my sister. You're not going
anywhere!""","ICE OVER 1: {i}, Choose and discard a card - Exert
chosen opposing character.",4,3,"[""ROJ-060""]",,,
"Hedvig H-S","Storyborn, Hero","Amethyst","","https://api.lorcana.ravensburger.com/images/en/set8/61_4a05eb9450e04f1a844bfa1df1e153b08f0a82c4.jpg",4,true,"Pinocchio - Strings Attached","Character",2,"Legendary",,"Evasive (Only characters with Evasive can
challenge this character.)
GOT TO KEEP REAL QUIET Once during your turn,
whenever you ready this character, you may draw
a card.",4,0,"[""ROJ-061""]",,,
"Rosa la Barbera / Livio Cacciatore","Storyborn, Mentor","Amethyst","","https://api.lorcana.ravensburger.com/images/en/set8/62_e662995e14c5b3332380f657cd6226c886381c8e.jpg",2,true,"Jiminy Cricket - Level-Headed and Wise","Character",1,"Rare",,"Evasive (Only characters with Evasive can
challenge this character.)
ENOUGH'S ENOUGH While this character is
exerted, opposing characters with Rush enter
play exerted.",1,1,"[""ROJ-062""]",,,
"Brian Weisz","Storyborn, Hero, Prince","Amethyst","","https://api.lorcana.ravensburger.com/images/en/set8/63_4bc96b78fb2ba12dff226ea9d12415dc98846835.jpg",3,false,"Bambi - Little Prince","Character",3,"Legendary",,"SAY HELLO: When you play this character, gain 1 lore.
KIND OF BASHFUL When an opponent plays a
character, return this character to your hand.",1,1,"[""ROJ-063""]",,,
"Alexandria Neonakis","Storyborn","Amethyst","","https://api.lorcana.ravensburger.com/images/en/set8/64_a235aab75c9722ec3a8b0ec018c736603fc33f86.jpg",8,true,"Monstro - Infamous Whale","Character",2,"Rare",,"Rush (This character can challenge the turn they're
played.)
FULL BREACH Choose and discard a card - Ready this
character. He can't quest for the rest of this turn.",8,6,"[""ROJ-064""]",,,
"Teresita Q. / SCG","Storyborn, Ally","Amethyst","","https://api.lorcana.ravensburger.com/images/en/set8/65_6aaca27591fbdab8b5ad7911a309a8dc5a7bc748.jpg",2,false,"Nero - Fearsome Crocodile","Character",1,"Common","He's identical to Brutus in temperament and
toothiness.","AND MEAN: {e} - Move 1 damage counter from
this character to chosen opposing character.",3,2,"[""ROJ-065""]",,,
"Sandara Tang","Storyborn, Villain, Sorcerer","Amethyst, Emerald","","https://api.lorcana.ravensburger.com/images/en/set8/66_5590ad928d7e71c6e8136f630a34b6cf5f0c957f.jpg",5,false,"Magica De Spell - Shadow Form","Character",2,"Uncommon",,"Evasive (Only characters with Evasive can
challenge this character.)
DANCE OF DARKNESS When you play this
character, you may return another chosen
character of yours to your hand to draw a card.",3,3,"[""ROJ-066""]",,,
"Kendall Hale","Floodborn, King","Amethyst, Emerald","","https://api.lorcana.ravensburger.com/images/en/set8/67_c48d584577b7e6e10f7b42e4667ff335e8284955.jpg",7,true,"Kuzco - Impulsive Llama","Character",2,"Rare",,"Shift 4 (You may pay 4 {i} to play this on top of one of your
characters named Kuzco.)
WHAT DOES THIS DO? When you play this character, each
opponent chooses one of their characters and puts that
card on the bottom of their deck. Then, each opponent may
draw a card.",5,5,"[""ROJ-067""]",,,
"Julien Vandois","Storyborn, Villain, Sorcerer","Amethyst, Emerald","","https://api.lorcana.ravensburger.com/images/en/set8/68_53c741362dad2c7bca84909b6d174c380484d327.jpg",6,false,"Yzma - On Edge","Character",2,"Super Rare",,"WHY DO WE EVEN HAVE THAT LEVER?: When you
play this character, if you have a card named Pull
the Lever! in your discard, you may search your
deck for a card named Wrong Lever! and reveal
that card to all players. Put that card into your
hand and shuffle your deck.",6,3,"[""ROJ-068""]",,,
"Alibeth Zermeno","Floodborn, Villain, Sorcerer","Amethyst, Ruby","","https://api.lorcana.ravensburger.com/images/en/set8/69_07c456151be28771ba9ab2298722d8403f11573a.jpg",6,false,"Madam Mim - Rhino","Character",1,"Uncommon",,"Shift 2 (You may pay 2 {i} to play this on top of
one of your characters named Madam Mim.)
MAKE WAY, COMING THROUGH! When you play
this character, banish her or return another
chosen character of yours to your hand.",5,6,"[""ROJ-069""]",,,
"Joel DuQue","Storyborn, Villain, Sorcerer","Amethyst, Ruby","","https://api.lorcana.ravensburger.com/images/en/set8/70_ae9ff9045f3946841e4db90edd5c65558967d647.jpg",2,false,"Mother Gothel - Knows What's Best","Character",1,"Rare",,"LOOK WHAT YOU'VE DONE: When you play this character,
you may deal 2 damage to another chosen character of
yours to give that character Challenger +1 and ""When this
character is banished in a challenge, return this card to
your hand"" this turn. (They get +1 {s} while challenging.)",3,1,"[""ROJ-070""]",,,
"Man? Kandalyan Manderson","Storyborn, Ally, Fairy","Amethyst, Sapphire","","https://api.lorcana.ravensburger.com/images/en/set8/71_54bb7279891728e7a17c952cbd7aec9746e0e684.jpg",2,true,"Blue Fairy - Guiding Light","Character",1,"Uncommon",,"Evasive (Only characters with Evasive can
challenge this character.)
Support (Whenever this character quests, you
may add their {s} to another chosen character's
{s} this turn.)",2,2,"[""ROJ-071""]",,,
"Luigi Aim?","Floodborn, Hero, Queen, Sorcerer","Amethyst, Sapphire","","https://api.lorcana.ravensburger.com/images/en/set8/72_9ee84ec10a2d5ae8462eefdf386b37fb99e3cf59.jpg",6,true,"Anna - Magical Mission","Character",2,"Rare",,"Shift 4 (You may pay 4 {i} to play this on top of one of your
characters named Anna.)
Support (Whenever this character quests, you may add their
{s} to another chosen character's {s} this turn.)
COORDINATED PLAN Whenever this character quests, if you
have a character named Elsa in play, you may draw a card.",6,3,"[""ROJ-072""]",,,
"Max Ulichney","Dreamborn, Ally, King, Illusion","Amethyst, Steel","","https://api.lorcana.ravensburger.com/images/en/set8/73_83b3589488f2a62af73e94fb219fdff0ef73a1f6.jpg",5,false,"The Sultan - Royal Apparition","Character",2,"Rare",,"Vanish (When an opponent chooses this character
for an action, banish them.)
COMMANDING PRESENCE Whenever one of your
Illusion characters quests, exert chosen opposing
character.",5,5,"[""ROJ-073""]",,,
"Cristian Romero","Dreamborn, Villain, King, Sorcerer","Amethyst, Steel","","https://api.lorcana.ravensburger.com/images/en/set8/74_195b797e7636b8d60ff061cbb3352d557fc17b2d.jpg",5,false,"Jafar - High Sultan of Lorcana","Character",3,"Super Rare",,"DARK POWER: Whenever this character quests,
you may draw a card, then choose and discard a
card. If an Illusion character card is discarded this
way, you may play that character for free.",4,4,"[""ROJ-074""]",,,
"Carlos Gomes Cabral","Storyborn, Ally, Madrigal","Amethyst","","https://api.lorcana.ravensburger.com/images/en/set8/75_4f8966284c051ea657db6ffde4072e219105c532.jpg",5,true,"Camilo Madrigal - Center Stage","Character",2,"Common","""My primo Camilo won't stop until he makes you
smile today.""
-Mirabel","ENCORE! ENCORE!: When this character is banished
in a challenge, return this card to your hand.",4,4,"[""ROJ-075""]",,,
"Sandra Rios","Storyborn, Ally","Amethyst","","https://api.lorcana.ravensburger.com/images/en/set8/76_7eada0448a07ed0ca02e1d4eb6acc57ae4690807.jpg",3,true,"Flower - Shy Skunk","Character",1,"Rare","His sweet nature outmatches all the blooms in the
meadow.","LOOKING FOR FRIENDS: Whenever you play another
character, look at the top card of your deck. Put it
on either the top or the bottom of your deck.",3,3,"[""ROJ-076""]",,,
"Viv Tanner",,"Amethyst","","https://api.lorcana.ravensburger.com/images/en/set8/77_4f676de3b01ac5e09bff758f970da3adc20e2751.jpg",5,true,"Forest Duel","Action",,"Uncommon","Fight with honor, win with dignity.","Your characters gain Challenger +2 and ""When this
character is banished in a challenge, return this
card to your hand"" this turn. (They get +2 {s} while
challenging.)",,,"[""ROJ-077""]",,,
"Saulo Nate",,"Amethyst","","https://api.lorcana.ravensburger.com/images/en/set8/78_a536cf1fc707534ce9ff7b134575801f49f15491.jpg",3,true,"They Never Come Back","Action",,"Uncommon","""You boys have had your fun. Now, pay for it.""
-The Coachman","Up to 2 chosen characters can't ready at the start of
their next turn. Draw a card.",,,"[""ROJ-078""]",,,
"Natalia Trykowska","Song","Amethyst","","https://api.lorcana.ravensburger.com/images/en/set8/79_4f6a9d5abb7ab8455c9e4339d349b584320ec7be.jpg",9,false,"Fantastical and Magical","Action - Song",,"Rare",,"Sing Together 9 (Any number of your or your
teammates' characters with total cost 9 or more may
{e} to sing this song for free.)
For each character that sang this song, draw a card
and gain 1 lore.",,,"[""ROJ-079""]",,,
"Mario Manzanares",,"Amethyst, Emerald","","https://api.lorcana.ravensburger.com/images/en/set8/80_2406b5aef7276513c3c81661726d134ad3ca90f8.jpg",3,true,"Pull the Lever!","Action",,"Uncommon",,"Choose one:
- Draw 2 cards.
- Each opponent chooses and discards a card.",,,"[""ROJ-080""]",,,
"Maria Dresden","Song","Amethyst, Sapphire","","https://api.lorcana.ravensburger.com/images/en/set8/81_25e0f1bfa276bb0f8b57d0e592405353d71b757b.jpg",3,true,"Into the Unknown","Action - Song",,"Super Rare",,"(A character with cost 3 or more can {e} to sing this
song for free.)
Put chosen exerted character into their player's inkwell
facedown and exerted.",,,"[""ROJ-081""]",,,
"Linh Dang",,"Amethyst","","https://api.lorcana.ravensburger.com/images/en/set8/82_cf2ea1fc54a5bc230366db04a695687eebd4bf58.jpg",4,true,"Everybody's Got a Weakness","Action",,"Rare",,"Move 1 damage counter from each damaged character
you have in play to chosen opposing character. Draw a
card for each damage counter moved this way.",,,"[""ROJ-082""]",,,
"Carlos Ruiz",,"Amethyst","","https://api.lorcana.ravensburger.com/images/en/set8/83_079beb48eb8393818e25e50a67e65be612b12eb9.jpg",2,false,"Scarab","Item",,"Common","""If we can catch one, maybe we can recalibrate it to
help us get rid of Jafar's illusions!""
-Venturo, an Illumineer","SEARCH THE SANDS: {e}, 2 {i} - Return an Illusion
character card from your discard to your hand.",,,"[""ROJ-083""]",,,
"Priya Kakati",,"Amethyst, Sapphire","","https://api.lorcana.ravensburger.com/images/en/set8/84_684ee493fd2767a14f07d6e357ab84ac673773a9.jpg",2,true,"Ice Spikes","Item",,"Uncommon",,"HOLD STILL: When you play this item, exert chosen
opposing character.
IT'S STUCK {e}, 1 {i} - Exert chosen opposing item.
It can't ready at the start of its next turn.",,,"[""ROJ-084""]",,,
"Aur?lie Lise-Anne","Storyborn, Ally","Emerald","","https://api.lorcana.ravensburger.com/images/en/set8/85_360ef467c550593ff6f3fec72b7f6585e242905c.jpg",3,true,"Wilhelmina Packard - The Radio Operator","Character",1,"Common","Helga: ""Sounds metallic. Could be an echo off one
of the rocks.""
Wilhelmina: ""Do you want to do my job? Be my guest.""",,4,3,"[""ROJ-085""]",,,
"Stefano Spagnuolo","Dreamborn, Hero, Detective","Emerald","","https://api.lorcana.ravensburger.com/images/en/set8/86_08ccb52387556ce62c14f436da95f8720baaa68a.jpg",7,true,"Basil - Undercover Detective","Character",2,"Rare",,"INCAPACITATE: When you play this character, you
may return chosen character to their player's hand.
INTERFERE Whenever this character quests, chosen
opponent discards a card at random.",4,5,"[""ROJ-086""]",,,
"Edu Francisco","Storyborn, Hero","Emerald","","https://api.lorcana.ravensburger.com/images/en/set8/87_01e6e0a7579db9740ac3085d669e4ba402e13d36.jpg",3,true,"Tramp - Observant Guardian","Character",1,"Common","One glance at the tiny tracks, and his protective instincts
kicked in.","HOW DO I GET IN?: When you play this character, chosen
character gains Ward until the start of your next turn.
(Opponents can't choose them except to challenge.)",3,3,"[""ROJ-087""]",,,
"Florencia Vazquez","Storyborn, Ally","Emerald","","https://api.lorcana.ravensburger.com/images/en/set8/88_bc2b7130b04c7200db4790b39889f2e2cd84098e.jpg",4,true,"Chaca - Junior Chipmunk","Character",1,"Common",,"IN CAHOOTS: When you play this character, if
you have a character named Tipo in play, chosen
opposing character gains Reckless during their next
turn. (They can't quest and must challenge if able.)",3,3,"[""ROJ-088""]",,,
"Florencia Vazquez","Storyborn, Ally","Emerald","","https://api.lorcana.ravensburger.com/images/en/set8/89_8af8976d364cdf9584c68d7dc8b77fcef5b8860f.jpg",2,true,"Tipo - Junior Chipmunk","Character",1,"Common","""This is so much fun, Chaca! I want to go higher!""","Evasive (Only characters with Evasive can
challenge this character.)",2,2,"[""ROJ-089""]",,,
"Kendall Hale","Storyborn","Emerald","","https://api.lorcana.ravensburger.com/images/en/set8/90_b0f2931c1aec674bb28cd9ae54471dc4a22cb6c7.jpg",1,true,"Bill the Lizard - Chimney Sweep","Character",1,"Common","""We need a lazard with a lizard!""
-White Rabbit","NOTHING TO IT: While another character in play
has damage, this character gains Evasive. (Only
characters with Evasive can challenge them.)",2,1,"[""ROJ-090""]",,,
"Dustin Panzino","Storyborn","Emerald","","https://api.lorcana.ravensburger.com/images/en/set8/91_2d0992163394b65487a2ef20ec77df014a47a3fa.jpg",4,true,"March Hare - Hare-Brained Eccentric","Character",1,"Common","He really knows how to light up a room.","LIGHT THE CANDLES: When you play this
character, you may deal 2 damage to chosen
damaged character.",4,3,"[""ROJ-091""]",,,
"Jared Nickerl / Patri Balanovsky","Storyborn, Hero","Emerald","","https://api.lorcana.ravensburger.com/images/en/set8/92_24c4c2b08319c4dbc231d640dfcdee7158ffa10c.jpg",3,true,"Fred - Major Science Enthusiast","Character",2,"Common","""Don't be alarmed. It is just a suit. This is not my
real face and body.""","SPITTING FIRE!: When you play this character, you
may banish chosen item.",3,2,"[""ROJ-092""]",,,
"Luis Huerta","Storyborn, Ally, Pirate","Emerald","","https://api.lorcana.ravensburger.com/images/en/set8/93_509130ff42ca870b5e2c39febf23d6a3e38d7de7.jpg",4,true,"Mad Dog - Karnage's First Mate","Character",1,"Common","He certainly isn't the brains of the operation.","ARE YOU SURE THIS IS SAFE, CAPTAIN?: If you have a
character named Don Karnage in play, you pay 1 {i}
less to play this character.",4,4,"[""ROJ-093""]",,,
"Wouter Bruneel","Storyborn, Hero","Emerald","","https://api.lorcana.ravensburger.com/images/en/set8/94_d9cdcac87116234fc9cbd461b24ba2f7206a9929.jpg",1,true,"Dale - Bumbler","Character",1,"Common","""You're the fearless copilot who can handle any
job....Did I say fearless? I meant brainless!""
-Chip",,3,1,"[""ROJ-094""]",,,
"Grace Tran","Storyborn, Ally","Emerald","","https://api.lorcana.ravensburger.com/images/en/set8/95_5b907a5ac16f71de91ebd0308d132565feaba67c.jpg",3,true,"Louis - Endearing Alligator","Character",1,"Uncommon",,"SENSITIVE SOUL: This character enters play exerted.
FRIENDLIER THAN HE LOOKS When you play this
character, chosen opposing character gains Reckless
during their next turn. (They can't quest and must
challenge if able.)",3,4,"[""ROJ-095""]",,,
"Mariana Moreno","Storyborn","Emerald","","https://api.lorcana.ravensburger.com/images/en/set8/96_b6a1340dd22233648675aa542fc61d49b6ae3524.jpg",4,true,"Napoleon - Clever Bloodhound","Character",1,"Uncommon","""Everyone knows that without rations, an
operation'll be a failure. And this is why I outrank
you, Lafayette. 'Cause I see the big picture.""",,6,3,"[""ROJ-096""]",,,
"Brian Weisz","Storyborn, Hero","Emerald","","https://api.lorcana.ravensburger.com/images/en/set8/97_54788faea60e5cab35d2d2240588d4d8c8f94e85.jpg",4,true,"Chip - Quick Thinker","Character",1,"Uncommon","""Don't worry, Dale! I've got you!""","I'LL HANDLE THIS When you play this character,
chosen opponent chooses and discards a card.",2,3,"[""ROJ-097""]",,,
"Jules Dubost","Floodborn, Hero","Emerald","","https://api.lorcana.ravensburger.com/images/en/set8/98_c845f1576380bb016047090ebcaf6d09a4ea05b1.jpg",7,true,"Fred - Giant-Sized","Character",3,"Rare",,"Shift 5 (You may pay 5 {i} to play this on top of one of
your characters named Fred.)
I LIKE WHERE THIS IS HEADING Whenever this character
quests, reveal cards from the top of your deck until you
reveal a Floodborn character card. Put that card into
your hand and shuffle the rest into your deck.",6,5,"[""ROJ-098""]",,,
"Lisanne Koeteeuw","Storyborn, Ally, Inventor","Emerald","","https://api.lorcana.ravensburger.com/images/en/set8/99_22615c491d4ffed7f36ae0e9be8d00da6da0d593.jpg",4,true,"Gadget Hackwrench - Quirky Scientist","Character",2,"Rare","""The scarab's power source! I knew that if I dug
around I'd find it!""","GOLLY!: When you play this character, if an
opponent has more cards in their hand than you,
you may draw a card.",2,3,"[""ROJ-099""]",,,
"Dustin Panzino","Storyborn, Hero, Princess","Emerald","","https://api.lorcana.ravensburger.com/images/en/set8/100_b0199315f7843a4298e44e697f987aceb0bb7c6f.jpg",6,true,"Raya - Infiltration Expert","Character",2,"Legendary",,"UNCONVENTIONAL TACTICS: Whenever this
character quests, you may pay 2 {i} to ready
another chosen character.",5,5,"[""ROJ-100""]",,,
"Alice Pisoni","Dreamborn, Hero, Princess","Emerald","","https://api.lorcana.ravensburger.com/images/en/set8/101_fc98fe9c34523ce5788e4800a735e7c68630f9fe.jpg",5,true,"Rapunzel - High Climber","Character",2,"Legendary",,"Evasive (Only characters with Evasive can
challenge this character.)
WRAPPED UP Whenever this character quests,
chosen opposing character can't quest during
their next turn.",5,2,"[""ROJ-101""]",,,
"Koni","Storyborn, Hero, Prince","Emerald","","https://api.lorcana.ravensburger.com/images/en/set8/102_deed1ba7dd28e4b0aa88a1dc955f68a977164e4f.jpg",4,false,"Flynn Rider - Breaking and Entering","Character",3,"Super Rare","""One way or another, I get what I want.""","THIS IS A VERY BIG DAY: Whenever this character
is challenged, the challenging player may choose
and discard a card. If they don't, you gain 2 lore.",4,1,"[""ROJ-102""]",,,
"Joel DuQue","Storyborn","Emerald, Ruby","","https://api.lorcana.ravensburger.com/images/en/set8/103_9ba90f5c7ea24182e507aef2fac1b1b7f781f8ea.jpg",2,true,"Dormouse - Easily Agitated","Character",1,"Uncommon","The tea is strong, even if he isn't.","VERY RUDE INDEED: When you play this character,
you may put 1 damage counter on chosen
character.",2,1,"[""ROJ-103""]",,,
"Arianna Rea","Floodborn, Hero","Emerald, Ruby","","https://api.lorcana.ravensburger.com/images/en/set8/104_e6732aa858a85d279a36dd2747771f2f4ce76057.jpg",6,true,"Alice - Clumsy as Can Be","Character",2,"Rare",,"Shift 3 (You may pay 3 {i} to play this on top of
one of your characters named Alice.)
ACCIDENT PRONE Whenever this character
quests, put 1 damage counter on each other
character.",6,2,"[""ROJ-104""]",,,
"Gonzalo Kenny","Storyborn, Villain, Queen","Emerald, Ruby","","https://api.lorcana.ravensburger.com/images/en/set8/105_210f51940ca9ae5719f44b87ba7a438739a91659.jpg",4,true,"Queen of Hearts - Haughty Monarch","Character",3,"Super Rare","She'll go wherever she pleases, no matter who she
has to step on to get there.","COUNT OFF!: While there are 5 or more characters
with damage in play, this character gets +3 {l}.",3,2,"[""ROJ-105""]",,,
"Kendall Hale","Storyborn, Hero, Inventor","Emerald, Sapphire","","https://api.lorcana.ravensburger.com/images/en/set8/106_9932b39a21df70fe7866e977a459b9dcdb1b827d.jpg",2,true,"Hiro Hamada - Intuitive Thinker","Character",1,"Uncommon",,"LOOK FOR A NEW ANGLE: {e} - Ready chosen
Floodborn character.",3,1,"[""ROJ-106""]",,,
"Beno Meli","Floodborn, Hero, Inventor","Emerald, Sapphire","","https://api.lorcana.ravensburger.com/images/en/set8/107_df39c0c74fba4299f8fdfc78002d161dccf091fb.jpg",4,false,"Go Go Tomago - Cutting Edge","Character",2,"Super Rare",,"Shift 4 (You may pay 4 {i} to play this on top of one of your
characters named Go Go Tomago.)
Evasive (Only characters with Evasive can challenge this
character.)
ZERO RESISTANCE When you play this character, if you used
Shift to play her, you may put chosen character into their
player's inkwell facedown and exerted.",3,3,"[""ROJ-107""]",,,
"Leonardo Giammichele","Storyborn, Villain, Prince, Pirate","Emerald, Steel","","https://api.lorcana.ravensburger.com/images/en/set8/108_a38bbd306f5fedea6b7b2a5979a571eca86b25ab.jpg",3,false,"Don Karnage - Air Pirate Leader","Character",1,"Uncommon",,"Evasive (Only characters with Evasive can
challenge this character.)
SCORNFUL TAUNT Whenever you play an action
that isn't a song, chosen opposing character gains
Reckless during their next turn. (They can't quest
and must challenge if able.)",2,3,"[""ROJ-108""]",,,
"Kenneth Anderson","Floodborn, Villain, King, Pirate, Captain","Emerald, Steel","","https://api.lorcana.ravensburger.com/images/en/set8/109_bf1b76255dafbf9e0e26b89b7a5a04edace5e3fe.jpg",5,true,"Captain Hook - The Pirate King","Character",2,"Rare",,"Shift 3 (You may pay 3 {i} to play this on top of one
of your characters named Captain Hook.)
GIVE 'EM ALL YOU GOT! Once during your turn,
whenever an opposing character is damaged, your
Pirate characters get +2 {s} and gain Resist +2 this
turn. (Damage dealt to them is reduced by 2.)",5,4,"[""ROJ-109""]",,,
"Natalie Dombois","Storyborn, Hero, Deity","Emerald, Steel","","https://api.lorcana.ravensburger.com/images/en/set8/110_048dd59e0774575666d5c0638d45dc571eadc339.jpg",6,true,"Maui - Stubborn Trickster","Character",3,"Super Rare",,"I'M NOT FINISHED YET When this character is banished,
choose one:
- Put 2 damage counters on all opposing characters.
- Banish all opposing items.
- Banish all opposing locations.",4,4,"[""ROJ-110""]",,,
"Adam Ford","Storyborn, Hero, Inventor","Emerald, Sapphire","","https://api.lorcana.ravensburger.com/images/en/set8/111_9815104f2881c9d5820e22e6ac6119e83e7f423b.jpg",4,true,"Honey Lemon - Costumed Catalyst","Character",2,"Rare",,"LET'S DO THIS!: Whenever you play a Floodborn
character, if you used Shift to play them, you may
return chosen character to their player's hand.",3,3,"[""ROJ-111""]",,,
"Raquel Villanueva","Storyborn, Ally","Emerald","","https://api.lorcana.ravensburger.com/images/en/set8/112_7a5cd74eb4114c5004e3233827d0586f9ba32d63.jpg",4,true,"Jock - Attentive Uncle","Character",1,"Common","""Settle in, ye wee pups, and let Uncle Jock tell ye a story
about some Illumineers and a mad adventure...""","VOICE OF EXPERIENCE: When you play this character, if
you have 3 or more other characters in play, gain 2 lore.",4,3,"[""ROJ-112""]",,,
"Gwawi","Storyborn, Ally","Emerald","","https://api.lorcana.ravensburger.com/images/en/set8/113_b0e854c5f20ad211457c996f212487fe1b8cd695.jpg",3,true,"Archimedes - Resourceful Owl","Character",2,"Rare",,"YOU DON'T NEED THAT: When you play this
character, you may banish chosen item.
NOW, THAT'S NOT BAD During your turn,
whenever an item is banished, you may draw a
card, then choose and discard a card.",2,2,"[""ROJ-113""]",,,
"Luis Huerta",,"Emerald","","https://api.lorcana.ravensburger.com/images/en/set8/114_ca6babf290e1ec435ee47fea96aadc5671756867.jpg",3,true,"He Who Steals and Runs Away","Action",,"Common","Lives to steal another day!","Banish chosen item. Draw a card.",,,"[""ROJ-114""]",,,
"Edu Francisco","Song","Emerald","","https://api.lorcana.ravensburger.com/images/en/set8/115_762df6e061fa8e3faa70bfa789620fb5990bf18a.jpg",8,true,"Stopped Chaos in Its Tracks","Action - Song",,"Uncommon",,"Sing Together 8 (Any number of your or your
teammates' characters with total cost 8 or more may
{e} to sing this song for free.)
Return up to 2 chosen characters with 3 {s} or less
each to their player's hand.",,,"[""ROJ-115""]",,,
"Cristian Romero",,"Emerald","","https://api.lorcana.ravensburger.com/images/en/set8/116_7abbbb8cd3265648a7365b76851755193fda6f27.jpg",3,true,"Wrong Lever!","Action",,"Rare",,"Choose one:
- Return chosen character to their player's hand.
- Put a card named Pull the Lever! from your discard on
the bottom of your deck to put chosen character on
the bottom of their player's deck.",,,"[""ROJ-116""]",,,
"Luigi Aim?",,"Emerald, Ruby","","https://api.lorcana.ravensburger.com/images/en/set8/117_9674c713f088e9b661cac2aa6d86cc6403465a5f.jpg",2,true,"Undermine","Action",,"Uncommon","""It's a real shame I didn't even get a chance to study it.""","Chosen opponent chooses and discards a card. Chosen
character gets +2 {s} this turn.",,,"[""ROJ-117""]",,,
"Alibeth Zermeno",,"Emerald, Steel","","https://api.lorcana.ravensburger.com/images/en/set8/118_3f8f19bd4f7219e9c8b5d0d8b9b6c8ffd509eb2a.jpg",3,false,"Walk the Plank!","Action",,"Uncommon","It was at this point that John decided he'd had quite
enough adventure.","Your Pirate characters gain ""{e} - Banish chosen
damaged character"" this turn.",,,"[""ROJ-118""]",,,
"Jared Nickerl",,"Emerald","","https://api.lorcana.ravensburger.com/images/en/set8/119_960584354e8dcea8b364285abd322ca9bc463d39.jpg",2,true,"Chem Purse","Item",,"Common","""Cute, but also potentially devastating. Perfect.""
-Honey Lemon","HERE'S THE BEST PART: Whenever you play a character,
if you used Shift to play them, they get +4 {s} this turn.",,,"[""ROJ-119""]",,,
"Filipe Laurentino",,"Emerald, Sapphire","","https://api.lorcana.ravensburger.com/images/en/set8/120_f9ab6bf84bd022d4309b8e647cf16923d3a12afa.jpg",2,true,"Jeweled Collar","Item",,"Uncommon","Archazia created many wondrous things, but none as
beautiful as this.","WELCOME EXTRAVAGANCE: Whenever one of your
characters is challenged, you may put the top card of
your deck into your inkwell facedown and exerted.",,,"[""ROJ-120""]",,,
